{
    "$id": "https://schemas.botframework.com/schemas/skills/skill-manifest-2.1.preview-0.json",
    "$schema": "http://json-schema.org/draft-07/schema#",
    "title": "Skill Manifest Schema (Preview)",
    "description": "A schema for Bot Framework skill manifests (Preview)",
    "type": "object",
    "required": [
        "$id",
        "name",
        "version",
        "publisherName",
        "endpoints"
    ],
    "properties": {
        "$schema": {
            "type": "string",
            "format": "uri",
            "description": "The schema to verify this skill manifest against"
        },
        "$id": {
            "type": "string",
            "description": "The identifier for the skill manifest"
        },
        "name": {
            "type": "string",
            "description": "Name of the skill"
        },
        "version": {
            "type": "string",
            "description": "Skill version"
        },
        "description": {
            "type": "string",
            "description": "A human readable description for the skill"
        },
        "publisherName": {
            "type": "string",
            "description": "The name of the skill publisher"
        },
        "privacyUrl": {
            "type": "string",
            "format": "uri",
            "description": "The URL with the privacy description for the skill"
        },
        "copyright": {
            "type": "string",
            "description": "The copyright for the skill"
        },
        "license": {
            "type": "string",
            "description": "The license agreement for the skill"
        },
        "iconUrl": {
            "type": "string",
            "format": "uri",
            "description": "Optional icon to be shown for the skill"
        },
        "tags": {
            "type": "array",
            "uniqueItems": true,
            "description": "An array of strings with tags for the skill"
        },
        "endpoints": {
            "type": "array",
            "minItems": 1,
            "uniqueItems": true,
            "description": "List of endpoints supported by the skill",
            "items": {
                "$ref": "#/definitions/endpoint"
            }
        },
        "dispatchModels": {
            "type": "object",
            "description": "Language models and intents for the skill",
            "properties": {
                "languages": {
                    "type": "object",
                    "description": "List of languages supported by the skill",
                    "minProperties": 1,
                    "additionalProperties": {
                        "oneOf": [
                            {
                                "type": "array",
                                "minItems": 1,
                                "uniqueItems": true,
                                "description": "List of language models supported by the skill",
                                "items": {
                                    "$ref": "#/definitions/languageModel"
                                }                               
                            }
                        ]
                    }
                },
                "intents": {
                    "type": "object",
                    "description": "A list of intents and a reference to activity that the skill expects for that intent",
                    "minProperties": 1,
                    "additionalProperties": {
                        "oneOf": [
                            {
                                "type": "string",
                                "format": "uri-reference",
                                "description": "Where does this show up?"
                            }
                        ]
                    }
                }
            },
            "additionalProperties": false
        },
        "activities": {
            "type": "object",
            "description": "Definition for the activities accepted by the skill",
            "additionalProperties": {
                "anyOf": [
                    {
                        "$ref": "#/definitions/eventActivity"
                    },
                    {
                        "$ref": "#/definitions/invokeActivity"
                    },
                    {
                        "$ref": "#/definitions/messageActivity"
                    }
                ]
            }
        },
        "activitiesSent": {
            "type": "object",
            "description": "Definition for the activities sent proactively by the skill",
            "additionalProperties": {
                "anyOf": [
                    {
                        "$ref": "#/definitions/eventActivity"
                    },
                    {
                        "$ref": "#/definitions/invokeActivity"
                    },
                    {
                        "$ref": "#/definitions/messageActivity"
                    }
                ]
            }
        },
        "definitions": {
            "type": "object",
            "description": "Definitions of the structure of object payloads",
            "additionalProperties": {
                "$ref": "http://json-schema.org/draft-07/schema#"
            }
        }
    },
    "additionalProperties": false,
    "definitions": {
        "endpoint": {
            "type": "object",
            "description": "Skill endpoint definition",
            "required": [
                "name",
                "endpointUrl",
                "msAppId"
            ],
            "properties": {
                "name": {
                    "type": "string",
                    "description": "Unique name for the endpoint",
                    "default": "default"
                },
                "protocol": {
                    "type": "string",
                    "description": "Supported protocol",
                    "default": "BotFrameworkV3"
                },
                "description": {
                    "type": "string",
                    "title": "Description",
                    "description": "Description of the endpoint",
                    "examples": [
                        "Production bot"
                    ]
                },
                "endpointUrl": {
                    "type": "string",
                    "title": "Endpoint Url",
                    "format": "uri",
                    "description": "Endpoint for the skill",
                    "examples": [
                        "http://contoso.com/api/messaages"
                    ]
                },
                "msAppId": {
                    "type": "string",
                    "title": "Microsoft App Id",
                    "pattern": "^[0-9A-Fa-f]{8}-[0-9A-Fa-f]{4}-[0-9A-Fa-f]{4}-[0-9A-Fa-f]{4}-[0-9A-Fa-f]{12}$",
                    "description": "The Microsoft AppId for the skill. This app ID is used to authenticate requests"
                }
            },
            "additionalProperties": false
        },
        "eventActivity": {
            "type": "object",
            "description": "An activity with Type=Event where the Name property indicates the task that the skill will execute",
            "required": [
                "type",
                "name"
            ],
            "properties": {
                "type": {
                    "type": "string",
                    "description": "The activity type",
                    "enum": [
                        "event"
                    ]
                },
                "name": {
                    "type": "string",
                    "description": "The name for the event",
                    "examples": [
                        "BookFlight"
                    ]
                },
                "description": {
                    "type": "string",
                    "title": "Description",
                    "description": "Description for the activity"
                },
                "value": {
                    "type": "object",
                    "description": "The JsonSchema definition of the shape of the value property that this event expects",
                    "$ref": "http://json-schema.org/draft-07/schema#"
                },
                "resultValue": {
                    "type": "object",
                    "description": "The JsonSchema definition of the shape of the resultValue that this event may produce",
                    "$ref": "http://json-schema.org/draft-07/schema#"
                }
            },
            "additionalProperties": false
        },
        "invokeActivity": {
            "type": "object",
            "description": "An activity with Type=Invoke where the Name property indicates the task that the skill will execute",
            "required": [
                "type",
                "name"
            ],
            "properties": {
                "type": {
                    "type": "string",
                    "description": "The activity type",
                    "enum": [
                        "invoke"
                    ]
                },
                "name": {
                    "type": "string",
                    "description": "The name property for the invoke activity",
                    "examples": [
                        "GetWeather"
                    ]
                },
                "description": {
                    "type": "string",
                    "title": "Description",
                    "description": "Description for the activity"
                },
                "value": {
                    "type": "object",
                    "description": "The JsonSchema definition of the shape of the value property that this event expects",
                    "$ref": "http://json-schema.org/draft-07/schema#"
                },
                "resultValue": {
                    "type": "object",
                    "description": "The JsonSchema definition of the shape of the resultValue that this event may produce",
                    "$ref": "http://json-schema.org/draft-07/schema#"
                }
            },
            "additionalProperties": false
        },
        "messageActivity": {
            "type": "object",
            "description": "An activity with Type=Message where the utterance is passed to the skill in the Text property",
            "required": [
                "type"
            ],
            "properties": {
                "type": {
                    "type": "string",
                    "description": "The activity type",
                    "enum": [
                        "message"
                    ],
                    "default": "message"
                },
                "description": {
                    "type": "string",
                    "title": "Description",
                    "description": "Description for the activity"
                },
                "value": {
                    "type": "object",
                    "description": "The JsonSchema definition of the shape of the value property that this message would like to have",
                    "$ref": "http://json-schema.org/draft-07/schema#"
                },
                "resultValue": {
                    "type": "object",
                    "description": "The JsonSchema definition of the shape of the resultValue that this message may produce",
                    "$ref": "http://json-schema.org/draft-07/schema#"
                }
            },
            "additionalProperties": false
        },
        "languageModel": {
            "type": "object",
            "description": "A language model for a given culture. The name is a combination of an ISO 639 two-letter lowercase culture code associated with a language and an ISO 3166 two-letter uppercase subculture code associated with a country or region",
            "required": [
                "id",
                "name",
                "contentType",
                "url"
            ],
            "properties": {
                "id": {
                    "type": "string",
                    "description": "Unique identifier for the language model"
                },
                "name": {
                    "type": "string",
                    "description": "Name for the language model"
                },
                "contentType": {
                    "type": "string",
                    "description": "Type of the language model"
                },
                "url": {
                    "type": "string",
                    "format": "uri",
                    "description": "A URL for the location of the language model file"
                },
                "description": {
                    "type": "string",
                    "title": "Description",
                    "description": "Description for the language model"
                }
            },
            "additionalProperties": false
        }        
    }
}